Sheet: Fix
B3: Initial rating | D3: 80
B4: Scoring diff > | D4: 5
B5: Championship weighting | D5: 3
B6: Ranking spread | D6: 15

Sheet: 1996CR1
B1: Team | C1: Rank | D1: Score | E1: Played | F1: Score | H1: Neutral venue | I1: Champ | J1: Ratings gap | K1: Limits | L1: Core rating | M1: WMM | N1: CM | O1: Sc diff > | P1: Champ wt | R1: new home sc | S1: new away sc | T1: 2000-06-12 | U1: change
B2: AH | C2: 81.205 | G2: of:=IF([.D2]<=[.F2];[.E2]+[.N2];[.E2]-[.N2]) -> 3 | I2: x | J2: of:=IF([.H2]="x";[.C2]-[.E2];[.C2]-[.E2]+3) -> 84.205 | K2: of:=IF([.J2]>[$Fix.$D$6];[$Fix.$D$6];IF([.J2]<-[$Fix.$D$6];-[$Fix.$D$6];[.J2])) -> 15 | L2: of:=ROUND(IF([.D2]>[.F2];1-(1/[$Fix.$D$6])*[.K2];IF([.D2]<[.F2];1+(1/[$Fix.$D$6])*[.K2];(1/[$Fix.$D$6])*[.K2]));2) -> 1 | M2: of:=IF(ABS([.D2]-[.F2])>[.O2];[.L2]*1.5;[.L2]) -> 1 | N2: of:=IF([.I2]="x";[.M2]*[.P2];[.M2]) -> 3 | O2: of:=[$Fix.$D$4] -> 5 | P2: of:=[$Fix.$D$5] -> 3 | Q2: of:=IF([.D2]>[.F2];[.C2]+[.N2];[.C2]-[.N2]) -> 78.205 | R2: of:=IF([.E2]="";"";[.Q2]) ->  | T2: of:=IF([.D2]="";[.C2];(IF([.E2]<>"";[.R2];[.S2]))) -> 81.205 | U2: of:=[.T2]-[.C2] -> 0
B3: AN | C3: 72.76 | G3: of:=IF([.D3]<=[.F3];[.E3]+[.N3];[.E3]-[.N3]) -> 3 | I3: x | J3: of:=IF([.H3]="x";[.C3]-[.E3];[.C3]-[.E3]+3) -> 75.76 | K3: of:=IF([.J3]>[$Fix.$D$6];[$Fix.$D$6];IF([.J3]<-[$Fix.$D$6];-[$Fix.$D$6];[.J3])) -> 15 | L3: of:=ROUND(IF([.D3]>[.F3];1-(1/[$Fix.$D$6])*[.K3];IF([.D3]<[.F3];1+(1/[$Fix.$D$6])*[.K3];(1/[$Fix.$D$6])*[.K3]));2) -> 1 | M3: of:=IF(ABS([.D3]-[.F3])>[.O3];[.L3]*1.5;[.L3]) -> 1 | N3: of:=IF([.I3]="x";[.M3]*[.P3];[.M3]) -> 3 | O3: of:=[$Fix.$D$4] -> 5 | P3: of:=[$Fix.$D$5] -> 3 | Q3: of:=IF([.D3]>[.F3];[.C3]+[.N3];[.C3]-[.N3]) -> 69.76 | R3: of:=IF([.E3]="";"";[.Q3]) ->  | T3: of:=IF([.D3]="";[.C3];(IF([.E3]<>"";[.R3];[.S3]))) -> 72.76 | U3: of:=[.T3]-[.C3] -> 0
B4: CE | C4: 77.555 | G4: of:=IF([.D4]<=[.F4];[.E4]+[.N4];[.E4]-[.N4]) -> 3 | I4: x | J4: of:=IF([.H4]="x";[.C4]-[.E4];[.C4]-[.E4]+3) -> 80.555 | K4: of:=IF([.J4]>[$Fix.$D$6];[$Fix.$D$6];IF([.J4]<-[$Fix.$D$6];-[$Fix.$D$6];[.J4])) -> 15 | L4: of:=ROUND(IF([.D4]>[.F4];1-(1/[$Fix.$D$6])*[.K4];IF([.D4]<[.F4];1+(1/[$Fix.$D$6])*[.K4];(1/[$Fix.$D$6])*[.K4]));2) -> 1 | M4: of:=IF(ABS([.D4]-[.F4])>[.O4];[.L4]*1.5;[.L4]) -> 1 | N4: of:=IF([.I4]="x";[.M4]*[.P4];[.M4]) -> 3 | O4: of:=[$Fix.$D$4] -> 5 | P4: of:=[$Fix.$D$5] -> 3 | Q4: of:=IF([.D4]>[.F4];[.C4]+[.N4];[.C4]-[.N4]) -> 74.555 | R4: of:=IF([.E4]="";"";[.Q4]) ->  | T4: of:=IF([.D4]="";[.C4];(IF([.E4]<>"";[.R4];[.S4]))) -> 77.555 | U4: of:=[.T4]-[.C4] -> 0
B5: CK | C5: 95.08 | G5: of:=IF([.D5]<=[.F5];[.E5]+[.N5];[.E5]-[.N5]) -> 3 | I5: x | J5: of:=IF([.H5]="x";[.C5]-[.E5];[.C5]-[.E5]+3) -> 98.08 | K5: of:=IF([.J5]>[$Fix.$D$6];[$Fix.$D$6];IF([.J5]<-[$Fix.$D$6];-[$Fix.$D$6];[.J5])) -> 15 | L5: of:=ROUND(IF([.D5]>[.F5];1-(1/[$Fix.$D$6])*[.K5];IF([.D5]<[.F5];1+(1/[$Fix.$D$6])*[.K5];(1/[$Fix.$D$6])*[.K5]));2) -> 1 | M5: of:=IF(ABS([.D5]-[.F5])>[.O5];[.L5]*1.5;[.L5]) -> 1 | N5: of:=IF([.I5]="x";[.M5]*[.P5];[.M5]) -> 3 | O5: of:=[$Fix.$D$4] -> 5 | P5: of:=[$Fix.$D$5] -> 3 | Q5: of:=IF([.D5]>[.F5];[.C5]+[.N5];[.C5]-[.N5]) -> 92.08 | R5: of:=IF([.E5]="";"";[.Q5]) ->  | T5: of:=IF([.D5]="";[.C5];(IF([.E5]<>"";[.R5];[.S5]))) -> 95.08 | U5: of:=[.T5]-[.C5] -> 0
B6: CN | C6: 85.03 | G6: of:=IF([.D6]<=[.F6];[.E6]+[.N6];[.E6]-[.N6]) -> 3 | I6: x | J6: of:=IF([.H6]="x";[.C6]-[.E6];[.C6]-[.E6]+3) -> 88.03 | K6: of:=IF([.J6]>[$Fix.$D$6];[$Fix.$D$6];IF([.J6]<-[$Fix.$D$6];-[$Fix.$D$6];[.J6])) -> 15 | L6: of:=ROUND(IF([.D6]>[.F6];1-(1/[$Fix.$D$6])*[.K6];IF([.D6]<[.F6];1+(1/[$Fix.$D$6])*[.K6];(1/[$Fix.$D$6])*[.K6]));2) -> 1 | M6: of:=IF(ABS([.D6]-[.F6])>[.O6];[.L6]*1.5;[.L6]) -> 1 | N6: of:=IF([.I6]="x";[.M6]*[.P6];[.M6]) -> 3 | O6: of:=[$Fix.$D$4] -> 5 | P6: of:=[$Fix.$D$5] -> 3 | Q6: of:=IF([.D6]>[.F6];[.C6]+[.N6];[.C6]-[.N6]) -> 82.03 | R6: of:=IF([.E6]="";"";[.Q6]) ->  | T6: of:=IF([.D6]="";[.C6];(IF([.E6]<>"";[.R6];[.S6]))) -> 85.03 | U6: of:=[.T6]-[.C6] -> 0
B7: CW | C7: 71.225 | D7: 29 | E7: of:=[.C35] -> 79.305 | F7: of:=[.D35] -> 14 | G7: of:=IF([.D7]<=[.F7];[.E7]+[.N7];[.E7]-[.N7]) -> 73.275 | I7: x | J7: of:=IF([.H7]="x";[.C7]-[.E7];[.C7]-[.E7]+3) -> -5.08000000000001 | K7: of:=IF([.J7]>[$Fix.$D$6];[$Fix.$D$6];IF([.J7]<-[$Fix.$D$6];-[$Fix.$D$6];[.J7])) -> -5.08000000000001 | L7: of:=ROUND(IF([.D7]>[.F7];1-(1/[$Fix.$D$6])*[.K7];IF([.D7]<[.F7];1+(1/[$Fix.$D$6])*[.K7];(1/[$Fix.$D$6])*[.K7]));2) -> 1.34 | M7: of:=IF(ABS([.D7]-[.F7])>[.O7];[.L7]*1.5;[.L7]) -> 2.01 | N7: of:=IF([.I7]="x";[.M7]*[.P7];[.M7]) -> 6.03 | O7: of:=[$Fix.$D$4] -> 5 | P7: of:=[$Fix.$D$5] -> 3 | Q7: of:=IF([.D7]>[.F7];[.C7]+[.N7];[.C7]-[.N7]) -> 77.255 | R7: of:=IF([.E7]="";"";[.Q7]) -> 77.255 | T7: of:=IF([.D7]="";[.C7];(IF([.E7]<>"";[.R7];[.S7]))) -> 77.255 | U7: of:=[.T7]-[.C7] -> 6.03
B8: Dublin | C8: 97.755 | G8: of:=IF([.D8]<=[.F8];[.E8]+[.N8];[.E8]-[.N8]) -> 3 | I8: x | J8: of:=IF([.H8]="x";[.C8]-[.E8];[.C8]-[.E8]+3) -> 100.755 | K8: of:=IF([.J8]>[$Fix.$D$6];[$Fix.$D$6];IF([.J8]<-[$Fix.$D$6];-[$Fix.$D$6];[.J8])) -> 15 | L8: of:=ROUND(IF([.D8]>[.F8];1-(1/[$Fix.$D$6])*[.K8];IF([.D8]<[.F8];1+(1/[$Fix.$D$6])*[.K8];(1/[$Fix.$D$6])*[.K8]));2) -> 1 | M8: of:=IF(ABS([.D8]-[.F8])>[.O8];[.L8]*1.5;[.L8]) -> 1 | N8: of:=IF([.I8]="x";[.M8]*[.P8];[.M8]) -> 3 | O8: of:=[$Fix.$D$4] -> 5 | P8: of:=[$Fix.$D$5] -> 3 | Q8: of:=IF([.D8]>[.F8];[.C8]+[.N8];[.C8]-[.N8]) -> 94.755 | R8: of:=IF([.E8]="";"";[.Q8]) ->  | T8: of:=IF([.D8]="";[.C8];(IF([.E8]<>"";[.R8];[.S8]))) -> 97.755 | U8: of:=[.T8]-[.C8] -> 0
B9: DL | C9: 88.54 | D9: 11 | G9: of:=IF([.D9]<=[.F9];[.E9]+[.N9];[.E9]-[.N9]) -> 0 | I9: x | J9: of:=IF([.H9]="x";[.C9]-[.E9];[.C9]-[.E9]+3) -> 91.54 | K9: of:=IF([.J9]>[$Fix.$D$6];[$Fix.$D$6];IF([.J9]<-[$Fix.$D$6];-[$Fix.$D$6];[.J9])) -> 15 | L9: of:=ROUND(IF([.D9]>[.F9];1-(1/[$Fix.$D$6])*[.K9];IF([.D9]<[.F9];1+(1/[$Fix.$D$6])*[.K9];(1/[$Fix.$D$6])*[.K9]));2) -> 0 | M9: of:=IF(ABS([.D9]-[.F9])>[.O9];[.L9]*1.5;[.L9]) -> 0 | N9: of:=IF([.I9]="x";[.M9]*[.P9];[.M9]) -> 0 | O9: of:=[$Fix.$D$4] -> 5 | P9: of:=[$Fix.$D$5] -> 3 | Q9: of:=IF([.D9]>[.F9];[.C9]+[.N9];[.C9]-[.N9]) -> 88.54 | R9: of:=IF([.E9]="";"";[.Q9]) ->  | S9: of:=[.G10] -> 85.09 | T9: of:=IF([.D9]="";[.C9];(IF([.E9]<>"";[.R9];[.S9]))) -> 85.09 | U9: of:=[.T9]-[.C9] -> -3.45
B10: Down | C10: 86.305 | D10: 12 | E10: of:=[.C9] -> 88.54 | F10: of:=[.D9] -> 11 | G10: of:=IF([.D10]<=[.F10];[.E10]+[.N10];[.E10]-[.N10]) -> 85.09 | H10: x | I10: x | J10: of:=IF([.H10]="x";[.C10]-[.E10];[.C10]-[.E10]+3) -> -2.235 | K10: of:=IF([.J10]>[$Fix.$D$6];[$Fix.$D$6];IF([.J10]<-[$Fix.$D$6];-[$Fix.$D$6];[.J10])) -> -2.235 | L10: of:=ROUND(IF([.D10]>[.F10];1-(1/[$Fix.$D$6])*[.K10];IF([.D10]<[.F10];1+(1/[$Fix.$D$6])*[.K10];(1/[$Fix.$D$6])*[.K10]));2) -> 1.15 | M10: of:=IF(ABS([.D10]-[.F10])>[.O10];[.L10]*1.5;[.L10]) -> 1.15 | N10: of:=IF([.I10]="x";[.M10]*[.P10];[.M10]) -> 3.45 | O10: of:=[$Fix.$D$4] -> 5 | P10: of:=[$Fix.$D$5] -> 3 | Q10: of:=IF([.D10]>[.F10];[.C10]+[.N10];[.C10]-[.N10]) -> 89.755 | R10: of:=IF([.E10]="";"";[.Q10]) -> 89.755 | T10: of:=IF([.D10]="";[.C10];(IF([.E10]<>"";[.R10];[.S10]))) -> 89.755 | U10: of:=[.T10]-[.C10] -> 3.45
B11: DY | C11: 95.495 | G11: of:=IF([.D11]<=[.F11];[.E11]+[.N11];[.E11]-[.N11]) -> 3 | I11: x | J11: of:=IF([.H11]="x";[.C11]-[.E11];[.C11]-[.E11]+3) -> 98.495 | K11: of:=IF([.J11]>[$Fix.$D$6];[$Fix.$D$6];IF([.J11]<-[$Fix.$D$6];-[$Fix.$D$6];[.J11])) -> 15 | L11: of:=ROUND(IF([.D11]>[.F11];1-(1/[$Fix.$D$6])*[.K11];IF([.D11]<[.F11];1+(1/[$Fix.$D$6])*[.K11];(1/[$Fix.$D$6])*[.K11]));2) -> 1 | M11: of:=IF(ABS([.D11]-[.F11])>[.O11];[.L11]*1.5;[.L11]) -> 1 | N11: of:=IF([.I11]="x";[.M11]*[.P11];[.M11]) -> 3 | O11: of:=[$Fix.$D$4] -> 5 | P11: of:=[$Fix.$D$5] -> 3 | Q11: of:=IF([.D11]>[.F11];[.C11]+[.N11];[.C11]-[.N11]) -> 92.495 | R11: of:=IF([.E11]="";"";[.Q11]) ->  | T11: of:=IF([.D11]="";[.C11];(IF([.E11]<>"";[.R11];[.S11]))) -> 95.495 | U11: of:=[.T11]-[.C11] -> 0
B12: FH | C12: 75.215 | G12: of:=IF([.D12]<=[.F12];[.E12]+[.N12];[.E12]-[.N12]) -> 3 | I12: x | J12: of:=IF([.H12]="x";[.C12]-[.E12];[.C12]-[.E12]+3) -> 78.215 | K12: of:=IF([.J12]>[$Fix.$D$6];[$Fix.$D$6];IF([.J12]<-[$Fix.$D$6];-[$Fix.$D$6];[.J12])) -> 15 | L12: of:=ROUND(IF([.D12]>[.F12];1-(1/[$Fix.$D$6])*[.K12];IF([.D12]<[.F12];1+(1/[$Fix.$D$6])*[.K12];(1/[$Fix.$D$6])*[.K12]));2) -> 1 | M12: of:=IF(ABS([.D12]-[.F12])>[.O12];[.L12]*1.5;[.L12]) -> 1 | N12: of:=IF([.I12]="x";[.M12]*[.P12];[.M12]) -> 3 | O12: of:=[$Fix.$D$4] -> 5 | P12: of:=[$Fix.$D$5] -> 3 | Q12: of:=IF([.D12]>[.F12];[.C12]+[.N12];[.C12]-[.N12]) -> 72.215 | R12: of:=IF([.E12]="";"";[.Q12]) ->  | T12: of:=IF([.D12]="";[.C12];(IF([.E12]<>"";[.R12];[.S12]))) -> 75.215 | U12: of:=[.T12]-[.C12] -> 0
B13: GY | C13: 81.865 | G13: of:=IF([.D13]<=[.F13];[.E13]+[.N13];[.E13]-[.N13]) -> 3 | I13: x | J13: of:=IF([.H13]="x";[.C13]-[.E13];[.C13]-[.E13]+3) -> 84.865 | K13: of:=IF([.J13]>[$Fix.$D$6];[$Fix.$D$6];IF([.J13]<-[$Fix.$D$6];-[$Fix.$D$6];[.J13])) -> 15 | L13: of:=ROUND(IF([.D13]>[.F13];1-(1/[$Fix.$D$6])*[.K13];IF([.D13]<[.F13];1+(1/[$Fix.$D$6])*[.K13];(1/[$Fix.$D$6])*[.K13]));2) -> 1 | M13: of:=IF(ABS([.D13]-[.F13])>[.O13];[.L13]*1.5;[.L13]) -> 1 | N13: of:=IF([.I13]="x";[.M13]*[.P13];[.M13]) -> 3 | O13: of:=[$Fix.$D$4] -> 5 | P13: of:=[$Fix.$D$5] -> 3 | Q13: of:=IF([.D13]>[.F13];[.C13]+[.N13];[.C13]-[.N13]) -> 78.865 | R13: of:=IF([.E13]="";"";[.Q13]) ->  | T13: of:=IF([.D13]="";[.C13];(IF([.E13]<>"";[.R13];[.S13]))) -> 81.865 | U13: of:=[.T13]-[.C13] -> 0
B14: KE | C14: 86.04 | G14: of:=IF([.D14]<=[.F14];[.E14]+[.N14];[.E14]-[.N14]) -> 3 | I14: x | J14: of:=IF([.H14]="x";[.C14]-[.E14];[.C14]-[.E14]+3) -> 89.04 | K14: of:=IF([.J14]>[$Fix.$D$6];[$Fix.$D$6];IF([.J14]<-[$Fix.$D$6];-[$Fix.$D$6];[.J14])) -> 15 | L14: of:=ROUND(IF([.D14]>[.F14];1-(1/[$Fix.$D$6])*[.K14];IF([.D14]<[.F14];1+(1/[$Fix.$D$6])*[.K14];(1/[$Fix.$D$6])*[.K14]));2) -> 1 | M14: of:=IF(ABS([.D14]-[.F14])>[.O14];[.L14]*1.5;[.L14]) -> 1 | N14: of:=IF([.I14]="x";[.M14]*[.P14];[.M14]) -> 3 | O14: of:=[$Fix.$D$4] -> 5 | P14: of:=[$Fix.$D$5] -> 3 | Q14: of:=IF([.D14]>[.F14];[.C14]+[.N14];[.C14]-[.N14]) -> 83.04 | R14: of:=IF([.E14]="";"";[.Q14]) ->  | T14: of:=IF([.D14]="";[.C14];(IF([.E14]<>"";[.R14];[.S14]))) -> 86.04 | U14: of:=[.T14]-[.C14] -> 0
B15: KK | C15: 61.085 | G15: of:=IF([.D15]<=[.F15];[.E15]+[.N15];[.E15]-[.N15]) -> 3 | I15: x | J15: of:=IF([.H15]="x";[.C15]-[.E15];[.C15]-[.E15]+3) -> 64.085 | K15: of:=IF([.J15]>[$Fix.$D$6];[$Fix.$D$6];IF([.J15]<-[$Fix.$D$6];-[$Fix.$D$6];[.J15])) -> 15 | L15: of:=ROUND(IF([.D15]>[.F15];1-(1/[$Fix.$D$6])*[.K15];IF([.D15]<[.F15];1+(1/[$Fix.$D$6])*[.K15];(1/[$Fix.$D$6])*[.K15]));2) -> 1 | M15: of:=IF(ABS([.D15]-[.F15])>[.O15];[.L15]*1.5;[.L15]) -> 1 | N15: of:=IF([.I15]="x";[.M15]*[.P15];[.M15]) -> 3 | O15: of:=[$Fix.$D$4] -> 5 | P15: of:=[$Fix.$D$5] -> 3 | Q15: of:=IF([.D15]>[.F15];[.C15]+[.N15];[.C15]-[.N15]) -> 58.085 | R15: of:=IF([.E15]="";"";[.Q15]) ->  | T15: of:=IF([.D15]="";[.C15];(IF([.E15]<>"";[.R15];[.S15]))) -> 61.085 | U15: of:=[.T15]-[.C15] -> 0
B16: KY | C16: 86.99 | G16: of:=IF([.D16]<=[.F16];[.E16]+[.N16];[.E16]-[.N16]) -> 3 | I16: x | J16: of:=IF([.H16]="x";[.C16]-[.E16];[.C16]-[.E16]+3) -> 89.99 | K16: of:=IF([.J16]>[$Fix.$D$6];[$Fix.$D$6];IF([.J16]<-[$Fix.$D$6];-[$Fix.$D$6];[.J16])) -> 15 | L16: of:=ROUND(IF([.D16]>[.F16];1-(1/[$Fix.$D$6])*[.K16];IF([.D16]<[.F16];1+(1/[$Fix.$D$6])*[.K16];(1/[$Fix.$D$6])*[.K16]));2) -> 1 | M16: of:=IF(ABS([.D16]-[.F16])>[.O16];[.L16]*1.5;[.L16]) -> 1 | N16: of:=IF([.I16]="x";[.M16]*[.P16];[.M16]) -> 3 | O16: of:=[$Fix.$D$4] -> 5 | P16: of:=[$Fix.$D$5] -> 3 | Q16: of:=IF([.D16]>[.F16];[.C16]+[.N16];[.C16]-[.N16]) -> 83.99 | R16: of:=IF([.E16]="";"";[.Q16]) ->  | T16: of:=IF([.D16]="";[.C16];(IF([.E16]<>"";[.R16];[.S16]))) -> 86.99 | U16: of:=[.T16]-[.C16] -> 0
B17: LD | C17: 73.65 | D17: 16 | E17: of:=[.C34] -> 75.405 | F17: of:=[.D34] -> 17 | G17: of:=IF([.D17]<=[.F17];[.E17]+[.N17];[.E17]-[.N17]) -> 78.645 | I17: x | J17: of:=IF([.H17]="x";[.C17]-[.E17];[.C17]-[.E17]+3) -> 1.245 | K17: of:=IF([.J17]>[$Fix.$D$6];[$Fix.$D$6];IF([.J17]<-[$Fix.$D$6];-[$Fix.$D$6];[.J17])) -> 1.245 | L17: of:=ROUND(IF([.D17]>[.F17];1-(1/[$Fix.$D$6])*[.K17];IF([.D17]<[.F17];1+(1/[$Fix.$D$6])*[.K17];(1/[$Fix.$D$6])*[.K17]));2) -> 1.08 | M17: of:=IF(ABS([.D17]-[.F17])>[.O17];[.L17]*1.5;[.L17]) -> 1.08 | N17: of:=IF([.I17]="x";[.M17]*[.P17];[.M17]) -> 3.24 | O17: of:=[$Fix.$D$4] -> 5 | P17: of:=[$Fix.$D$5] -> 3 | Q17: of:=IF([.D17]>[.F17];[.C17]+[.N17];[.C17]-[.N17]) -> 70.41 | R17: of:=IF([.E17]="";"";[.Q17]) -> 70.41 | T17: of:=IF([.D17]="";[.C17];(IF([.E17]<>"";[.R17];[.S17]))) -> 70.41 | U17: of:=[.T17]-[.C17] -> -3.23999999999999
B18: LH | C18: 86.29 | G18: of:=IF([.D18]<=[.F18];[.E18]+[.N18];[.E18]-[.N18]) -> 3 | I18: x | J18: of:=IF([.H18]="x";[.C18]-[.E18];[.C18]-[.E18]+3) -> 89.29 | K18: of:=IF([.J18]>[$Fix.$D$6];[$Fix.$D$6];IF([.J18]<-[$Fix.$D$6];-[$Fix.$D$6];[.J18])) -> 15 | L18: of:=ROUND(IF([.D18]>[.F18];1-(1/[$Fix.$D$6])*[.K18];IF([.D18]<[.F18];1+(1/[$Fix.$D$6])*[.K18];(1/[$Fix.$D$6])*[.K18]));2) -> 1 | M18: of:=IF(ABS([.D18]-[.F18])>[.O18];[.L18]*1.5;[.L18]) -> 1 | N18: of:=IF([.I18]="x";[.M18]*[.P18];[.M18]) -> 3 | O18: of:=[$Fix.$D$4] -> 5 | P18: of:=[$Fix.$D$5] -> 3 | Q18: of:=IF([.D18]>[.F18];[.C18]+[.N18];[.C18]-[.N18]) -> 83.29 | R18: of:=IF([.E18]="";"";[.Q18]) ->  | T18: of:=IF([.D18]="";[.C18];(IF([.E18]<>"";[.R18];[.S18]))) -> 86.29 | U18: of:=[.T18]-[.C18] -> 0
B19: LK | C19: 69.45 | G19: of:=IF([.D19]<=[.F19];[.E19]+[.N19];[.E19]-[.N19]) -> 3 | I19: x | J19: of:=IF([.H19]="x";[.C19]-[.E19];[.C19]-[.E19]+3) -> 72.45 | K19: of:=IF([.J19]>[$Fix.$D$6];[$Fix.$D$6];IF([.J19]<-[$Fix.$D$6];-[$Fix.$D$6];[.J19])) -> 15 | L19: of:=ROUND(IF([.D19]>[.F19];1-(1/[$Fix.$D$6])*[.K19];IF([.D19]<[.F19];1+(1/[$Fix.$D$6])*[.K19];(1/[$Fix.$D$6])*[.K19]));2) -> 1 | M19: of:=IF(ABS([.D19]-[.F19])>[.O19];[.L19]*1.5;[.L19]) -> 1 | N19: of:=IF([.I19]="x";[.M19]*[.P19];[.M19]) -> 3 | O19: of:=[$Fix.$D$4] -> 5 | P19: of:=[$Fix.$D$5] -> 3 | Q19: of:=IF([.D19]>[.F19];[.C19]+[.N19];[.C19]-[.N19]) -> 66.45 | R19: of:=IF([.E19]="";"";[.Q19]) ->  | T19: of:=IF([.D19]="";[.C19];(IF([.E19]<>"";[.R19];[.S19]))) -> 69.45 | U19: of:=[.T19]-[.C19] -> 0
B20: LM | C20: 82.88 | G20: of:=IF([.D20]<=[.F20];[.E20]+[.N20];[.E20]-[.N20]) -> 3 | I20: x | J20: of:=IF([.H20]="x";[.C20]-[.E20];[.C20]-[.E20]+3) -> 85.88 | K20: of:=IF([.J20]>[$Fix.$D$6];[$Fix.$D$6];IF([.J20]<-[$Fix.$D$6];-[$Fix.$D$6];[.J20])) -> 15 | L20: of:=ROUND(IF([.D20]>[.F20];1-(1/[$Fix.$D$6])*[.K20];IF([.D20]<[.F20];1+(1/[$Fix.$D$6])*[.K20];(1/[$Fix.$D$6])*[.K20]));2) -> 1 | M20: of:=IF(ABS([.D20]-[.F20])>[.O20];[.L20]*1.5;[.L20]) -> 1 | N20: of:=IF([.I20]="x";[.M20]*[.P20];[.M20]) -> 3 | O20: of:=[$Fix.$D$4] -> 5 | P20: of:=[$Fix.$D$5] -> 3 | Q20: of:=IF([.D20]>[.F20];[.C20]+[.N20];[.C20]-[.N20]) -> 79.88 | R20: of:=IF([.E20]="";"";[.Q20]) ->  | T20: of:=IF([.D20]="";[.C20];(IF([.E20]<>"";[.R20];[.S20]))) -> 82.88 | U20: of:=[.T20]-[.C20] -> 0
B21: London | C21: 61.5 | G21: of:=IF([.D21]<=[.F21];[.E21]+[.N21];[.E21]-[.N21]) -> 3 | I21: x | J21: of:=IF([.H21]="x";[.C21]-[.E21];[.C21]-[.E21]+3) -> 64.5 | K21: of:=IF([.J21]>[$Fix.$D$6];[$Fix.$D$6];IF([.J21]<-[$Fix.$D$6];-[$Fix.$D$6];[.J21])) -> 15 | L21: of:=ROUND(IF([.D21]>[.F21];1-(1/[$Fix.$D$6])*[.K21];IF([.D21]<[.F21];1+(1/[$Fix.$D$6])*[.K21];(1/[$Fix.$D$6])*[.K21]));2) -> 1 | M21: of:=IF(ABS([.D21]-[.F21])>[.O21];[.L21]*1.5;[.L21]) -> 1 | N21: of:=IF([.I21]="x";[.M21]*[.P21];[.M21]) -> 3 | O21: of:=[$Fix.$D$4] -> 5 | P21: of:=[$Fix.$D$5] -> 3 | Q21: of:=IF([.D21]>[.F21];[.C21]+[.N21];[.C21]-[.N21]) -> 58.5 | R21: of:=IF([.E21]="";"";[.Q21]) ->  | T21: of:=IF([.D21]="";[.C21];(IF([.E21]<>"";[.R21];[.S21]))) -> 61.5 | U21: of:=[.T21]-[.C21] -> 0
B22: LS | C22: 82.015 | G22: of:=IF([.D22]<=[.F22];[.E22]+[.N22];[.E22]-[.N22]) -> 3 | I22: x | J22: of:=IF([.H22]="x";[.C22]-[.E22];[.C22]-[.E22]+3) -> 85.015 | K22: of:=IF([.J22]>[$Fix.$D$6];[$Fix.$D$6];IF([.J22]<-[$Fix.$D$6];-[$Fix.$D$6];[.J22])) -> 15 | L22: of:=ROUND(IF([.D22]>[.F22];1-(1/[$Fix.$D$6])*[.K22];IF([.D22]<[.F22];1+(1/[$Fix.$D$6])*[.K22];(1/[$Fix.$D$6])*[.K22]));2) -> 1 | M22: of:=IF(ABS([.D22]-[.F22])>[.O22];[.L22]*1.5;[.L22]) -> 1 | N22: of:=IF([.I22]="x";[.M22]*[.P22];[.M22]) -> 3 | O22: of:=[$Fix.$D$4] -> 5 | P22: of:=[$Fix.$D$5] -> 3 | Q22: of:=IF([.D22]>[.F22];[.C22]+[.N22];[.C22]-[.N22]) -> 79.015 | R22: of:=IF([.E22]="";"";[.Q22]) ->  | T22: of:=IF([.D22]="";[.C22];(IF([.E22]<>"";[.R22];[.S22]))) -> 82.015 | U22: of:=[.T22]-[.C22] -> 0
B23: MH | C23: 85.55 | G23: of:=IF([.D23]<=[.F23];[.E23]+[.N23];[.E23]-[.N23]) -> 3 | I23: x | J23: of:=IF([.H23]="x";[.C23]-[.E23];[.C23]-[.E23]+3) -> 88.55 | K23: of:=IF([.J23]>[$Fix.$D$6];[$Fix.$D$6];IF([.J23]<-[$Fix.$D$6];-[$Fix.$D$6];[.J23])) -> 15 | L23: of:=ROUND(IF([.D23]>[.F23];1-(1/[$Fix.$D$6])*[.K23];IF([.D23]<[.F23];1+(1/[$Fix.$D$6])*[.K23];(1/[$Fix.$D$6])*[.K23]));2) -> 1 | M23: of:=IF(ABS([.D23]-[.F23])>[.O23];[.L23]*1.5;[.L23]) -> 1 | N23: of:=IF([.I23]="x";[.M23]*[.P23];[.M23]) -> 3 | O23: of:=[$Fix.$D$4] -> 5 | P23: of:=[$Fix.$D$5] -> 3 | Q23: of:=IF([.D23]>[.F23];[.C23]+[.N23];[.C23]-[.N23]) -> 82.55 | R23: of:=IF([.E23]="";"";[.Q23]) ->  | T23: of:=IF([.D23]="";[.C23];(IF([.E23]<>"";[.R23];[.S23]))) -> 85.55 | U23: of:=[.T23]-[.C23] -> 0
B24: Monaghan | C24: 87.34 | G24: of:=IF([.D24]<=[.F24];[.E24]+[.N24];[.E24]-[.N24]) -> 3 | I24: x | J24: of:=IF([.H24]="x";[.C24]-[.E24];[.C24]-[.E24]+3) -> 90.34 | K24: of:=IF([.J24]>[$Fix.$D$6];[$Fix.$D$6];IF([.J24]<-[$Fix.$D$6];-[$Fix.$D$6];[.J24])) -> 15 | L24: of:=ROUND(IF([.D24]>[.F24];1-(1/[$Fix.$D$6])*[.K24];IF([.D24]<[.F24];1+(1/[$Fix.$D$6])*[.K24];(1/[$Fix.$D$6])*[.K24]));2) -> 1 | M24: of:=IF(ABS([.D24]-[.F24])>[.O24];[.L24]*1.5;[.L24]) -> 1 | N24: of:=IF([.I24]="x";[.M24]*[.P24];[.M24]) -> 3 | O24: of:=[$Fix.$D$4] -> 5 | P24: of:=[$Fix.$D$5] -> 3 | Q24: of:=IF([.D24]>[.F24];[.C24]+[.N24];[.C24]-[.N24]) -> 84.34 | R24: of:=IF([.E24]="";"";[.Q24]) ->  | T24: of:=IF([.D24]="";[.C24];(IF([.E24]<>"";[.R24];[.S24]))) -> 87.34 | U24: of:=[.T24]-[.C24] -> 0
B25: MO | C25: 85.745 | G25: of:=IF([.D25]<=[.F25];[.E25]+[.N25];[.E25]-[.N25]) -> 3 | I25: x | J25: of:=IF([.H25]="x";[.C25]-[.E25];[.C25]-[.E25]+3) -> 88.745 | K25: of:=IF([.J25]>[$Fix.$D$6];[$Fix.$D$6];IF([.J25]<-[$Fix.$D$6];-[$Fix.$D$6];[.J25])) -> 15 | L25: of:=ROUND(IF([.D25]>[.F25];1-(1/[$Fix.$D$6])*[.K25];IF([.D25]<[.F25];1+(1/[$Fix.$D$6])*[.K25];(1/[$Fix.$D$6])*[.K25]));2) -> 1 | M25: of:=IF(ABS([.D25]-[.F25])>[.O25];[.L25]*1.5;[.L25]) -> 1 | N25: of:=IF([.I25]="x";[.M25]*[.P25];[.M25]) -> 3 | O25: of:=[$Fix.$D$4] -> 5 | P25: of:=[$Fix.$D$5] -> 3 | Q25: of:=IF([.D25]>[.F25];[.C25]+[.N25];[.C25]-[.N25]) -> 82.745 | R25: of:=IF([.E25]="";"";[.Q25]) ->  | T25: of:=IF([.D25]="";[.C25];(IF([.E25]<>"";[.R25];[.S25]))) -> 85.745 | U25: of:=[.T25]-[.C25] -> 0
B26: NY | C26: 0 | G26: of:=IF([.D26]<=[.F26];[.E26]+[.N26];[.E26]-[.N26]) -> 0.6 | I26: x | J26: of:=IF([.H26]="x";[.C26]-[.E26];[.C26]-[.E26]+3) -> 3 | K26: of:=IF([.J26]>[$Fix.$D$6];[$Fix.$D$6];IF([.J26]<-[$Fix.$D$6];-[$Fix.$D$6];[.J26])) -> 3 | L26: of:=ROUND(IF([.D26]>[.F26];1-(1/[$Fix.$D$6])*[.K26];IF([.D26]<[.F26];1+(1/[$Fix.$D$6])*[.K26];(1/[$Fix.$D$6])*[.K26]));2) -> 0.2 | M26: of:=IF(ABS([.D26]-[.F26])>[.O26];[.L26]*1.5;[.L26]) -> 0.2 | N26: of:=IF([.I26]="x";[.M26]*[.P26];[.M26]) -> 0.6 | O26: of:=[$Fix.$D$4] -> 5 | P26: of:=[$Fix.$D$5] -> 3 | Q26: of:=IF([.D26]>[.F26];[.C26]+[.N26];[.C26]-[.N26]) -> -0.6 | R26: of:=IF([.E26]="";"";[.Q26]) ->  | T26: of:=IF([.D26]="";[.C26];(IF([.E26]<>"";[.R26];[.S26]))) -> 0 | U26: of:=[.T26]-[.C26] -> 0
B27: OY | C27: 72.945 | G27: of:=IF([.D27]<=[.F27];[.E27]+[.N27];[.E27]-[.N27]) -> 3 | I27: x | J27: of:=IF([.H27]="x";[.C27]-[.E27];[.C27]-[.E27]+3) -> 75.945 | K27: of:=IF([.J27]>[$Fix.$D$6];[$Fix.$D$6];IF([.J27]<-[$Fix.$D$6];-[$Fix.$D$6];[.J27])) -> 15 | L27: of:=ROUND(IF([.D27]>[.F27];1-(1/[$Fix.$D$6])*[.K27];IF([.D27]<[.F27];1+(1/[$Fix.$D$6])*[.K27];(1/[$Fix.$D$6])*[.K27]));2) -> 1 | M27: of:=IF(ABS([.D27]-[.F27])>[.O27];[.L27]*1.5;[.L27]) -> 1 | N27: of:=IF([.I27]="x";[.M27]*[.P27];[.M27]) -> 3 | O27: of:=[$Fix.$D$4] -> 5 | P27: of:=[$Fix.$D$5] -> 3 | Q27: of:=IF([.D27]>[.F27];[.C27]+[.N27];[.C27]-[.N27]) -> 69.945 | R27: of:=IF([.E27]="";"";[.Q27]) ->  | T27: of:=IF([.D27]="";[.C27];(IF([.E27]<>"";[.R27];[.S27]))) -> 72.945 | U27: of:=[.T27]-[.C27] -> 0
B28: RN | C28: 82.09 | G28: of:=IF([.D28]<=[.F28];[.E28]+[.N28];[.E28]-[.N28]) -> 3 | I28: x | J28: of:=IF([.H28]="x";[.C28]-[.E28];[.C28]-[.E28]+3) -> 85.09 | K28: of:=IF([.J28]>[$Fix.$D$6];[$Fix.$D$6];IF([.J28]<-[$Fix.$D$6];-[$Fix.$D$6];[.J28])) -> 15 | L28: of:=ROUND(IF([.D28]>[.F28];1-(1/[$Fix.$D$6])*[.K28];IF([.D28]<[.F28];1+(1/[$Fix.$D$6])*[.K28];(1/[$Fix.$D$6])*[.K28]));2) -> 1 | M28: of:=IF(ABS([.D28]-[.F28])>[.O28];[.L28]*1.5;[.L28]) -> 1 | N28: of:=IF([.I28]="x";[.M28]*[.P28];[.M28]) -> 3 | O28: of:=[$Fix.$D$4] -> 5 | P28: of:=[$Fix.$D$5] -> 3 | Q28: of:=IF([.D28]>[.F28];[.C28]+[.N28];[.C28]-[.N28]) -> 79.09 | R28: of:=IF([.E28]="";"";[.Q28]) ->  | T28: of:=IF([.D28]="";[.C28];(IF([.E28]<>"";[.R28];[.S28]))) -> 82.09 | U28: of:=[.T28]-[.C28] -> 0
B29: SO | C29: 69.99 | G29: of:=IF([.D29]<=[.F29];[.E29]+[.N29];[.E29]-[.N29]) -> 3 | I29: x | J29: of:=IF([.H29]="x";[.C29]-[.E29];[.C29]-[.E29]+3) -> 72.99 | K29: of:=IF([.J29]>[$Fix.$D$6];[$Fix.$D$6];IF([.J29]<-[$Fix.$D$6];-[$Fix.$D$6];[.J29])) -> 15 | L29: of:=ROUND(IF([.D29]>[.F29];1-(1/[$Fix.$D$6])*[.K29];IF([.D29]<[.F29];1+(1/[$Fix.$D$6])*[.K29];(1/[$Fix.$D$6])*[.K29]));2) -> 1 | M29: of:=IF(ABS([.D29]-[.F29])>[.O29];[.L29]*1.5;[.L29]) -> 1 | N29: of:=IF([.I29]="x";[.M29]*[.P29];[.M29]) -> 3 | O29: of:=[$Fix.$D$4] -> 5 | P29: of:=[$Fix.$D$5] -> 3 | Q29: of:=IF([.D29]>[.F29];[.C29]+[.N29];[.C29]-[.N29]) -> 66.99 | R29: of:=IF([.E29]="";"";[.Q29]) ->  | T29: of:=IF([.D29]="";[.C29];(IF([.E29]<>"";[.R29];[.S29]))) -> 69.99 | U29: of:=[.T29]-[.C29] -> 0
B30: TP | C30: 74.875 | G30: of:=IF([.D30]<=[.F30];[.E30]+[.N30];[.E30]-[.N30]) -> 3 | I30: x | J30: of:=IF([.H30]="x";[.C30]-[.E30];[.C30]-[.E30]+3) -> 77.875 | K30: of:=IF([.J30]>[$Fix.$D$6];[$Fix.$D$6];IF([.J30]<-[$Fix.$D$6];-[$Fix.$D$6];[.J30])) -> 15 | L30: of:=ROUND(IF([.D30]>[.F30];1-(1/[$Fix.$D$6])*[.K30];IF([.D30]<[.F30];1+(1/[$Fix.$D$6])*[.K30];(1/[$Fix.$D$6])*[.K30]));2) -> 1 | M30: of:=IF(ABS([.D30]-[.F30])>[.O30];[.L30]*1.5;[.L30]) -> 1 | N30: of:=IF([.I30]="x";[.M30]*[.P30];[.M30]) -> 3 | O30: of:=[$Fix.$D$4] -> 5 | P30: of:=[$Fix.$D$5] -> 3 | Q30: of:=IF([.D30]>[.F30];[.C30]+[.N30];[.C30]-[.N30]) -> 71.875 | R30: of:=IF([.E30]="";"";[.Q30]) ->  | T30: of:=IF([.D30]="";[.C30];(IF([.E30]<>"";[.R30];[.S30]))) -> 74.875 | U30: of:=[.T30]-[.C30] -> 0
B31: TY | C31: 91.985 | G31: of:=IF([.D31]<=[.F31];[.E31]+[.N31];[.E31]-[.N31]) -> 3 | I31: x | J31: of:=IF([.H31]="x";[.C31]-[.E31];[.C31]-[.E31]+3) -> 94.985 | K31: of:=IF([.J31]>[$Fix.$D$6];[$Fix.$D$6];IF([.J31]<-[$Fix.$D$6];-[$Fix.$D$6];[.J31])) -> 15 | L31: of:=ROUND(IF([.D31]>[.F31];1-(1/[$Fix.$D$6])*[.K31];IF([.D31]<[.F31];1+(1/[$Fix.$D$6])*[.K31];(1/[$Fix.$D$6])*[.K31]));2) -> 1 | M31: of:=IF(ABS([.D31]-[.F31])>[.O31];[.L31]*1.5;[.L31]) -> 1 | N31: of:=IF([.I31]="x";[.M31]*[.P31];[.M31]) -> 3 | O31: of:=[$Fix.$D$4] -> 5 | P31: of:=[$Fix.$D$5] -> 3 | Q31: of:=IF([.D31]>[.F31];[.C31]+[.N31];[.C31]-[.N31]) -> 88.985 | R31: of:=IF([.E31]="";"";[.Q31]) ->  | T31: of:=IF([.D31]="";[.C31];(IF([.E31]<>"";[.R31];[.S31]))) -> 91.985 | U31: of:=[.T31]-[.C31] -> 0
B32: WD | C32: 65.815 | G32: of:=IF([.D32]<=[.F32];[.E32]+[.N32];[.E32]-[.N32]) -> 3 | I32: x | J32: of:=IF([.H32]="x";[.C32]-[.E32];[.C32]-[.E32]+3) -> 68.815 | K32: of:=IF([.J32]>[$Fix.$D$6];[$Fix.$D$6];IF([.J32]<-[$Fix.$D$6];-[$Fix.$D$6];[.J32])) -> 15 | L32: of:=ROUND(IF([.D32]>[.F32];1-(1/[$Fix.$D$6])*[.K32];IF([.D32]<[.F32];1+(1/[$Fix.$D$6])*[.K32];(1/[$Fix.$D$6])*[.K32]));2) -> 1 | M32: of:=IF(ABS([.D32]-[.F32])>[.O32];[.L32]*1.5;[.L32]) -> 1 | N32: of:=IF([.I32]="x";[.M32]*[.P32];[.M32]) -> 3 | O32: of:=[$Fix.$D$4] -> 5 | P32: of:=[$Fix.$D$5] -> 3 | Q32: of:=IF([.D32]>[.F32];[.C32]+[.N32];[.C32]-[.N32]) -> 62.815 | R32: of:=IF([.E32]="";"";[.Q32]) ->  | T32: of:=IF([.D32]="";[.C32];(IF([.E32]<>"";[.R32];[.S32]))) -> 65.815 | U32: of:=[.T32]-[.C32] -> 0
B33: WH | C33: 71.025 | G33: of:=IF([.D33]<=[.F33];[.E33]+[.N33];[.E33]-[.N33]) -> 3 | I33: x | J33: of:=IF([.H33]="x";[.C33]-[.E33];[.C33]-[.E33]+3) -> 74.025 | K33: of:=IF([.J33]>[$Fix.$D$6];[$Fix.$D$6];IF([.J33]<-[$Fix.$D$6];-[$Fix.$D$6];[.J33])) -> 15 | L33: of:=ROUND(IF([.D33]>[.F33];1-(1/[$Fix.$D$6])*[.K33];IF([.D33]<[.F33];1+(1/[$Fix.$D$6])*[.K33];(1/[$Fix.$D$6])*[.K33]));2) -> 1 | M33: of:=IF(ABS([.D33]-[.F33])>[.O33];[.L33]*1.5;[.L33]) -> 1 | N33: of:=IF([.I33]="x";[.M33]*[.P33];[.M33]) -> 3 | O33: of:=[$Fix.$D$4] -> 5 | P33: of:=[$Fix.$D$5] -> 3 | Q33: of:=IF([.D33]>[.F33];[.C33]+[.N33];[.C33]-[.N33]) -> 68.025 | R33: of:=IF([.E33]="";"";[.Q33]) ->  | T33: of:=IF([.D33]="";[.C33];(IF([.E33]<>"";[.R33];[.S33]))) -> 71.025 | U33: of:=[.T33]-[.C33] -> 0
B34: WW | C34: 75.405 | D34: 17 | G34: of:=IF([.D34]<=[.F34];[.E34]+[.N34];[.E34]-[.N34]) -> 0 | I34: x | J34: of:=IF([.H34]="x";[.C34]-[.E34];[.C34]-[.E34]+3) -> 78.405 | K34: of:=IF([.J34]>[$Fix.$D$6];[$Fix.$D$6];IF([.J34]<-[$Fix.$D$6];-[$Fix.$D$6];[.J34])) -> 15 | L34: of:=ROUND(IF([.D34]>[.F34];1-(1/[$Fix.$D$6])*[.K34];IF([.D34]<[.F34];1+(1/[$Fix.$D$6])*[.K34];(1/[$Fix.$D$6])*[.K34]));2) -> 0 | M34: of:=IF(ABS([.D34]-[.F34])>[.O34];[.L34]*1.5;[.L34]) -> 0 | N34: of:=IF([.I34]="x";[.M34]*[.P34];[.M34]) -> 0 | O34: of:=[$Fix.$D$4] -> 5 | P34: of:=[$Fix.$D$5] -> 3 | Q34: of:=IF([.D34]>[.F34];[.C34]+[.N34];[.C34]-[.N34]) -> 75.405 | R34: of:=IF([.E34]="";"";[.Q34]) ->  | S34: of:=[.G17] -> 78.645 | T34: of:=IF([.D34]="";[.C34];(IF([.E34]<>"";[.R34];[.S34]))) -> 78.645 | U34: of:=[.T34]-[.C34] -> 3.23999999999999
B35: WX | C35: 79.305 | D35: 14 | G35: of:=IF([.D35]<=[.F35];[.E35]+[.N35];[.E35]-[.N35]) -> 0 | I35: x | J35: of:=IF([.H35]="x";[.C35]-[.E35];[.C35]-[.E35]+3) -> 82.305 | K35: of:=IF([.J35]>[$Fix.$D$6];[$Fix.$D$6];IF([.J35]<-[$Fix.$D$6];-[$Fix.$D$6];[.J35])) -> 15 | L35: of:=ROUND(IF([.D35]>[.F35];1-(1/[$Fix.$D$6])*[.K35];IF([.D35]<[.F35];1+(1/[$Fix.$D$6])*[.K35];(1/[$Fix.$D$6])*[.K35]));2) -> 0 | M35: of:=IF(ABS([.D35]-[.F35])>[.O35];[.L35]*1.5;[.L35]) -> 0 | N35: of:=IF([.I35]="x";[.M35]*[.P35];[.M35]) -> 0 | O35: of:=[$Fix.$D$4] -> 5 | P35: of:=[$Fix.$D$5] -> 3 | Q35: of:=IF([.D35]>[.F35];[.C35]+[.N35];[.C35]-[.N35]) -> 79.305 | R35: of:=IF([.E35]="";"";[.Q35]) ->  | S35: of:=[.G7] -> 73.275 | T35: of:=IF([.D35]="";[.C35];(IF([.E35]<>"";[.R35];[.S35]))) -> 73.275 | U35: of:=[.T35]-[.C35] -> -6.03
T36: of:=SUM([.T2:.T35]) -> 2640 | U36: of:=SUM([.U2:.U35]) -> 0

Sheet: 1996CR2
B1: Team | C1: Rank | D1: Score | E1: Played | F1: Score | H1: Neutral venue | I1: Champ | J1: Ratings gap | K1: Limits | L1: Core rating | M1: WMM | N1: CM | O1: Sc diff > | P1: Champ wt | R1: new home sc | S1: new away sc | T1: 2000-06-18 | U1: change
B2: AH | C2: of:=[1996CR1.T2] -> 81.205 | G2: of:=IF([.D2]<=[.F2];[.E2]+[.N2];[.E2]-[.N2]) -> 3 | I2: x | J2: of:=IF([.H2]="x";[.C2]-[.E2];[.C2]-[.E2]+3) -> 84.205 | K2: of:=IF([.J2]>[$Fix.$D$6];[$Fix.$D$6];IF([.J2]<-[$Fix.$D$6];-[$Fix.$D$6];[.J2])) -> 15 | L2: of:=ROUND(IF([.D2]>[.F2];1-(1/[$Fix.$D$6])*[.K2];IF([.D2]<[.F2];1+(1/[$Fix.$D$6])*[.K2];(1/[$Fix.$D$6])*[.K2]));2) -> 1 | M2: of:=IF(ABS([.D2]-[.F2])>[.O2];[.L2]*1.5;[.L2]) -> 1 | N2: of:=IF([.I2]="x";[.M2]*[.P2];[.M2]) -> 3 | O2: of:=[$Fix.$D$4] -> 5 | P2: of:=[$Fix.$D$5] -> 3 | Q2: of:=IF([.D2]>[.F2];[.C2]+[.N2];[.C2]-[.N2]) -> 78.205 | R2: of:=IF([.E2]="";"";[.Q2]) ->  | T2: of:=IF([.D2]="";[.C2];(IF([.E2]<>"";[.R2];[.S2]))) -> 81.205 | U2: of:=[.T2]-[.C2] -> 0
B3: AN | C3: of:=[1996CR1.T3] -> 72.76 | G3: of:=IF([.D3]<=[.F3];[.E3]+[.N3];[.E3]-[.N3]) -> 3 | I3: x | J3: of:=IF([.H3]="x";[.C3]-[.E3];[.C3]-[.E3]+3) -> 75.76 | K3: of:=IF([.J3]>[$Fix.$D$6];[$Fix.$D$6];IF([.J3]<-[$Fix.$D$6];-[$Fix.$D$6];[.J3])) -> 15 | L3: of:=ROUND(IF([.D3]>[.F3];1-(1/[$Fix.$D$6])*[.K3];IF([.D3]<[.F3];1+(1/[$Fix.$D$6])*[.K3];(1/[$Fix.$D$6])*[.K3]));2) -> 1 | M3: of:=IF(ABS([.D3]-[.F3])>[.O3];[.L3]*1.5;[.L3]) -> 1 | N3: of:=IF([.I3]="x";[.M3]*[.P3];[.M3]) -> 3 | O3: of:=[$Fix.$D$4] -> 5 | P3: of:=[$Fix.$D$5] -> 3 | Q3: of:=IF([.D3]>[.F3];[.C3]+[.N3];[.C3]-[.N3]) -> 69.76 | R3: of:=IF([.E3]="";"";[.Q3]) ->  | T3: of:=IF([.D3]="";[.C3];(IF([.E3]<>"";[.R3];[.S3]))) -> 72.76 | U3: of:=[.T3]-[.C3] -> 0
B4: CE | C4: of:=[1996CR1.T4] -> 77.555 | G4: of:=IF([.D4]<=[.F4];[.E4]+[.N4];[.E4]-[.N4]) -> 3 | I4: x | J4: of:=IF([.H4]="x";[.C4]-[.E4];[.C4]-[.E4]+3) -> 80.555 | K4: of:=IF([.J4]>[$Fix.$D$6];[$Fix.$D$6];IF([.J4]<-[$Fix.$D$6];-[$Fix.$D$6];[.J4])) -> 15 | L4: of:=ROUND(IF([.D4]>[.F4];1-(1/[$Fix.$D$6])*[.K4];IF([.D4]<[.F4];1+(1/[$Fix.$D$6])*[.K4];(1/[$Fix.$D$6])*[.K4]));2) -> 1 | M4: of:=IF(ABS([.D4]-[.F4])>[.O4];[.L4]*1.5;[.L4]) -> 1 | N4: of:=IF([.I4]="x";[.M4]*[.P4];[.M4]) -> 3 | O4: of:=[$Fix.$D$4] -> 5 | P4: of:=[$Fix.$D$5] -> 3 | Q4: of:=IF([.D4]>[.F4];[.C4]+[.N4];[.C4]-[.N4]) -> 74.555 | R4: of:=IF([.E4]="";"";[.Q4]) ->  | T4: of:=IF([.D4]="";[.C4];(IF([.E4]<>"";[.R4];[.S4]))) -> 77.555 | U4: of:=[.T4]-[.C4] -> 0
B5: CK | C5: of:=[1996CR1.T5] -> 95.08 | G5: of:=IF([.D5]<=[.F5];[.E5]+[.N5];[.E5]-[.N5]) -> 3 | I5: x | J5: of:=IF([.H5]="x";[.C5]-[.E5];[.C5]-[.E5]+3) -> 98.08 | K5: of:=IF([.J5]>[$Fix.$D$6];[$Fix.$D$6];IF([.J5]<-[$Fix.$D$6];-[$Fix.$D$6];[.J5])) -> 15 | L5: of:=ROUND(IF([.D5]>[.F5];1-(1/[$Fix.$D$6])*[.K5];IF([.D5]<[.F5];1+(1/[$Fix.$D$6])*[.K5];(1/[$Fix.$D$6])*[.K5]));2) -> 1 | M5: of:=IF(ABS([.D5]-[.F5])>[.O5];[.L5]*1.5;[.L5]) -> 1 | N5: of:=IF([.I5]="x";[.M5]*[.P5];[.M5]) -> 3 | O5: of:=[$Fix.$D$4] -> 5 | P5: of:=[$Fix.$D$5] -> 3 | Q5: of:=IF([.D5]>[.F5];[.C5]+[.N5];[.C5]-[.N5]) -> 92.08 | R5: of:=IF([.E5]="";"";[.Q5]) ->  | T5: of:=IF([.D5]="";[.C5];(IF([.E5]<>"";[.R5];[.S5]))) -> 95.08 | U5: of:=[.T5]-[.C5] -> 0
B6: CN | C6: of:=[1996CR1.T6] -> 85.03 | G6: of:=IF([.D6]<=[.F6];[.E6]+[.N6];[.E6]-[.N6]) -> 3 | I6: x | J6: of:=IF([.H6]="x";[.C6]-[.E6];[.C6]-[.E6]+3) -> 88.03 | K6: of:=IF([.J6]>[$Fix.$D$6];[$Fix.$D$6];IF([.J6]<-[$Fix.$D$6];-[$Fix.$D$6];[.J6])) -> 15 | L6: of:=ROUND(IF([.D6]>[.F6];1-(1/[$Fix.$D$6])*[.K6];IF([.D6]<[.F6];1+(1/[$Fix.$D$6])*[.K6];(1/[$Fix.$D$6])*[.K6]));2) -> 1 | M6: of:=IF(ABS([.D6]-[.F6])>[.O6];[.L6]*1.5;[.L6]) -> 1 | N6: of:=IF([.I6]="x";[.M6]*[.P6];[.M6]) -> 3 | O6: of:=[$Fix.$D$4] -> 5 | P6: of:=[$Fix.$D$5] -> 3 | Q6: of:=IF([.D6]>[.F6];[.C6]+[.N6];[.C6]-[.N6]) -> 82.03 | R6: of:=IF([.E6]="";"";[.Q6]) ->  | T6: of:=IF([.D6]="";[.C6];(IF([.E6]<>"";[.R6];[.S6]))) -> 85.03 | U6: of:=[.T6]-[.C6] -> 0
B7: CW | C7: of:=[1996CR1.T7] -> 77.255 | D7: 19 | E7: of:=[.C34] -> 78.645 | F7: of:=[.D34] -> 16 | G7: of:=IF([.D7]<=[.F7];[.E7]+[.N7];[.E7]-[.N7]) -> 75.375 | H7: x | I7: x | J7: of:=IF([.H7]="x";[.C7]-[.E7];[.C7]-[.E7]+3) -> -1.39 | K7: of:=IF([.J7]>[$Fix.$D$6];[$Fix.$D$6];IF([.J7]<-[$Fix.$D$6];-[$Fix.$D$6];[.J7])) -> -1.39 | L7: of:=ROUND(IF([.D7]>[.F7];1-(1/[$Fix.$D$6])*[.K7];IF([.D7]<[.F7];1+(1/[$Fix.$D$6])*[.K7];(1/[$Fix.$D$6])*[.K7]));2) -> 1.09 | M7: of:=IF(ABS([.D7]-[.F7])>[.O7];[.L7]*1.5;[.L7]) -> 1.09 | N7: of:=IF([.I7]="x";[.M7]*[.P7];[.M7]) -> 3.27 | O7: of:=[$Fix.$D$4] -> 5 | P7: of:=[$Fix.$D$5] -> 3 | Q7: of:=IF([.D7]>[.F7];[.C7]+[.N7];[.C7]-[.N7]) -> 80.525 | R7: of:=IF([.E7]="";"";[.Q7]) -> 80.525 | T7: of:=IF([.D7]="";[.C7];(IF([.E7]<>"";[.R7];[.S7]))) -> 80.525 | U7: of:=[.T7]-[.C7] -> 3.27
B8: Dublin | C8: of:=[1996CR1.T8] -> 97.755 | G8: of:=IF([.D8]<=[.F8];[.E8]+[.N8];[.E8]-[.N8]) -> 3 | I8: x | J8: of:=IF([.H8]="x";[.C8]-[.E8];[.C8]-[.E8]+3) -> 100.755 | K8: of:=IF([.J8]>[$Fix.$D$6];[$Fix.$D$6];IF([.J8]<-[$Fix.$D$6];-[$Fix.$D$6];[.J8])) -> 15 | L8: of:=ROUND(IF([.D8]>[.F8];1-(1/[$Fix.$D$6])*[.K8];IF([.D8]<[.F8];1+(1/[$Fix.$D$6])*[.K8];(1/[$Fix.$D$6])*[.K8]));2) -> 1 | M8: of:=IF(ABS([.D8]-[.F8])>[.O8];[.L8]*1.5;[.L8]) -> 1 | N8: of:=IF([.I8]="x";[.M8]*[.P8];[.M8]) -> 3 | O8: of:=[$Fix.$D$4] -> 5 | P8: of:=[$Fix.$D$5] -> 3 | Q8: of:=IF([.D8]>[.F8];[.C8]+[.N8];[.C8]-[.N8]) -> 94.755 | R8: of:=IF([.E8]="";"";[.Q8]) ->  | T8: of:=IF([.D8]="";[.C8];(IF([.E8]<>"";[.R8];[.S8]))) -> 97.755 | U8: of:=[.T8]-[.C8] -> 0
B9: DL | C9: of:=[1996CR1.T9] -> 85.09 | G9: of:=IF([.D9]<=[.F9];[.E9]+[.N9];[.E9]-[.N9]) -> 3 | I9: x | J9: of:=IF([.H9]="x";[.C9]-[.E9];[.C9]-[.E9]+3) -> 88.09 | K9: of:=IF([.J9]>[$Fix.$D$6];[$Fix.$D$6];IF([.J9]<-[$Fix.$D$6];-[$Fix.$D$6];[.J9])) -> 15 | L9: of:=ROUND(IF([.D9]>[.F9];1-(1/[$Fix.$D$6])*[.K9];IF([.D9]<[.F9];1+(1/[$Fix.$D$6])*[.K9];(1/[$Fix.$D$6])*[.K9]));2) -> 1 | M9: of:=IF(ABS([.D9]-[.F9])>[.O9];[.L9]*1.5;[.L9]) -> 1 | N9: of:=IF([.I9]="x";[.M9]*[.P9];[.M9]) -> 3 | O9: of:=[$Fix.$D$4] -> 5 | P9: of:=[$Fix.$D$5] -> 3 | Q9: of:=IF([.D9]>[.F9];[.C9]+[.N9];[.C9]-[.N9]) -> 82.09 | R9: of:=IF([.E9]="";"";[.Q9]) ->  | T9: of:=IF([.D9]="";[.C9];(IF([.E9]<>"";[.R9];[.S9]))) -> 85.09 | U9: of:=[.T9]-[.C9] -> 0
B10: Down | C10: of:=[1996CR1.T10] -> 89.755 | G10: of:=IF([.D10]<=[.F10];[.E10]+[.N10];[.E10]-[.N10]) -> 3 | I10: x | J10: of:=IF([.H10]="x";[.C10]-[.E10];[.C10]-[.E10]+3) -> 92.755 | K10: of:=IF([.J10]>[$Fix.$D$6];[$Fix.$D$6];IF([.J10]<-[$Fix.$D$6];-[$Fix.$D$6];[.J10])) -> 15 | L10: of:=ROUND(IF([.D10]>[.F10];1-(1/[$Fix.$D$6])*[.K10];IF([.D10]<[.F10];1+(1/[$Fix.$D$6])*[.K10];(1/[$Fix.$D$6])*[.K10]));2) -> 1 | M10: of:=IF(ABS([.D10]-[.F10])>[.O10];[.L10]*1.5;[.L10]) -> 1 | N10: of:=IF([.I10]="x";[.M10]*[.P10];[.M10]) -> 3 | O10: of:=[$Fix.$D$4] -> 5 | P10: of:=[$Fix.$D$5] -> 3 | Q10: of:=IF([.D10]>[.F10];[.C10]+[.N10];[.C10]-[.N10]) -> 86.755 | R10: of:=IF([.E10]="";"";[.Q10]) ->  | T10: of:=IF([.D10]="";[.C10];(IF([.E10]<>"";[.R10];[.S10]))) -> 89.755 | U10: of:=[.T10]-[.C10] -> 0
B11: DY | C11: of:=[1996CR1.T11] -> 95.495 | G11: of:=IF([.D11]<=[.F11];[.E11]+[.N11];[.E11]-[.N11]) -> 3 | I11: x | J11: of:=IF([.H11]="x";[.C11]-[.E11];[.C11]-[.E11]+3) -> 98.495 | K11: of:=IF([.J11]>[$Fix.$D$6];[$Fix.$D$6];IF([.J11]<-[$Fix.$D$6];-[$Fix.$D$6];[.J11])) -> 15 | L11: of:=ROUND(IF([.D11]>[.F11];1-(1/[$Fix.$D$6])*[.K11];IF([.D11]<[.F11];1+(1/[$Fix.$D$6])*[.K11];(1/[$Fix.$D$6])*[.K11]));2) -> 1 | M11: of:=IF(ABS([.D11]-[.F11])>[.O11];[.L11]*1.5;[.L11]) -> 1 | N11: of:=IF([.I11]="x";[.M11]*[.P11];[.M11]) -> 3 | O11: of:=[$Fix.$D$4] -> 5 | P11: of:=[$Fix.$D$5] -> 3 | Q11: of:=IF([.D11]>[.F11];[.C11]+[.N11];[.C11]-[.N11]) -> 92.495 | R11: of:=IF([.E11]="";"";[.Q11]) ->  | T11: of:=IF([.D11]="";[.C11];(IF([.E11]<>"";[.R11];[.S11]))) -> 95.495 | U11: of:=[.T11]-[.C11] -> 0
B12: FH | C12: of:=[1996CR1.T12] -> 75.215 | G12: of:=IF([.D12]<=[.F12];[.E12]+[.N12];[.E12]-[.N12]) -> 3 | I12: x | J12: of:=IF([.H12]="x";[.C12]-[.E12];[.C12]-[.E12]+3) -> 78.215 | K12: of:=IF([.J12]>[$Fix.$D$6];[$Fix.$D$6];IF([.J12]<-[$Fix.$D$6];-[$Fix.$D$6];[.J12])) -> 15 | L12: of:=ROUND(IF([.D12]>[.F12];1-(1/[$Fix.$D$6])*[.K12];IF([.D12]<[.F12];1+(1/[$Fix.$D$6])*[.K12];(1/[$Fix.$D$6])*[.K12]));2) -> 1 | M12: of:=IF(ABS([.D12]-[.F12])>[.O12];[.L12]*1.5;[.L12]) -> 1 | N12: of:=IF([.I12]="x";[.M12]*[.P12];[.M12]) -> 3 | O12: of:=[$Fix.$D$4] -> 5 | P12: of:=[$Fix.$D$5] -> 3 | Q12: of:=IF([.D12]>[.F12];[.C12]+[.N12];[.C12]-[.N12]) -> 72.215 | R12: of:=IF([.E12]="";"";[.Q12]) ->  | T12: of:=IF([.D12]="";[.C12];(IF([.E12]<>"";[.R12];[.S12]))) -> 75.215 | U12: of:=[.T12]-[.C12] -> 0
B13: GY | C13: of:=[1996CR1.T13] -> 81.865 | G13: of:=IF([.D13]<=[.F13];[.E13]+[.N13];[.E13]-[.N13]) -> 3 | I13: x | J13: of:=IF([.H13]="x";[.C13]-[.E13];[.C13]-[.E13]+3) -> 84.865 | K13: of:=IF([.J13]>[$Fix.$D$6];[$Fix.$D$6];IF([.J13]<-[$Fix.$D$6];-[$Fix.$D$6];[.J13])) -> 15 | L13: of:=ROUND(IF([.D13]>[.F13];1-(1/[$Fix.$D$6])*[.K13];IF([.D13]<[.F13];1+(1/[$Fix.$D$6])*[.K13];(1/[$Fix.$D$6])*[.K13]));2) -> 1 | M13: of:=IF(ABS([.D13]-[.F13])>[.O13];[.L13]*1.5;[.L13]) -> 1 | N13: of:=IF([.I13]="x";[.M13]*[.P13];[.M13]) -> 3 | O13: of:=[$Fix.$D$4] -> 5 | P13: of:=[$Fix.$D$5] -> 3 | Q13: of:=IF([.D13]>[.F13];[.C13]+[.N13];[.C13]-[.N13]) -> 78.865 | R13: of:=IF([.E13]="";"";[.Q13]) ->  | T13: of:=IF([.D13]="";[.C13];(IF([.E13]<>"";[.R13];[.S13]))) -> 81.865 | U13: of:=[.T13]-[.C13] -> 0
B14: KE | C14: of:=[1996CR1.T14] -> 86.04 | G14: of:=IF([.D14]<=[.F14];[.E14]+[.N14];[.E14]-[.N14]) -> 3 | I14: x | J14: of:=IF([.H14]="x";[.C14]-[.E14];[.C14]-[.E14]+3) -> 89.04 | K14: of:=IF([.J14]>[$Fix.$D$6];[$Fix.$D$6];IF([.J14]<-[$Fix.$D$6];-[$Fix.$D$6];[.J14])) -> 15 | L14: of:=ROUND(IF([.D14]>[.F14];1-(1/[$Fix.$D$6])*[.K14];IF([.D14]<[.F14];1+(1/[$Fix.$D$6])*[.K14];(1/[$Fix.$D$6])*[.K14]));2) -> 1 | M14: of:=IF(ABS([.D14]-[.F14])>[.O14];[.L14]*1.5;[.L14]) -> 1 | N14: of:=IF([.I14]="x";[.M14]*[.P14];[.M14]) -> 3 | O14: of:=[$Fix.$D$4] -> 5 | P14: of:=[$Fix.$D$5] -> 3 | Q14: of:=IF([.D14]>[.F14];[.C14]+[.N14];[.C14]-[.N14]) -> 83.04 | R14: of:=IF([.E14]="";"";[.Q14]) ->  | T14: of:=IF([.D14]="";[.C14];(IF([.E14]<>"";[.R14];[.S14]))) -> 86.04 | U14: of:=[.T14]-[.C14] -> 0
B15: KK | C15: of:=[1996CR1.T15] -> 61.085 | G15: of:=IF([.D15]<=[.F15];[.E15]+[.N15];[.E15]-[.N15]) -> 3 | I15: x | J15: of:=IF([.H15]="x";[.C15]-[.E15];[.C15]-[.E15]+3) -> 64.085 | K15: of:=IF([.J15]>[$Fix.$D$6];[$Fix.$D$6];IF([.J15]<-[$Fix.$D$6];-[$Fix.$D$6];[.J15])) -> 15 | L15: of:=ROUND(IF([.D15]>[.F15];1-(1/[$Fix.$D$6])*[.K15];IF([.D15]<[.F15];1+(1/[$Fix.$D$6])*[.K15];(1/[$Fix.$D$6])*[.K15]));2) -> 1 | M15: of:=IF(ABS([.D15]-[.F15])>[.O15];[.L15]*1.5;[.L15]) -> 1 | N15: of:=IF([.I15]="x";[.M15]*[.P15];[.M15]) -> 3 | O15: of:=[$Fix.$D$4] -> 5 | P15: of:=[$Fix.$D$5] -> 3 | Q15: of:=IF([.D15]>[.F15];[.C15]+[.N15];[.C15]-[.N15]) -> 58.085 | R15: of:=IF([.E15]="";"";[.Q15]) ->  | T15: of:=IF([.D15]="";[.C15];(IF([.E15]<>"";[.R15];[.S15]))) -> 61.085 | U15: of:=[.T15]-[.C15] -> 0
B16: KY | C16: of:=[1996CR1.T16] -> 86.99 | G16: of:=IF([.D16]<=[.F16];[.E16]+[.N16];[.E16]-[.N16]) -> 3 | I16: x | J16: of:=IF([.H16]="x";[.C16]-[.E16];[.C16]-[.E16]+3) -> 89.99 | K16: of:=IF([.J16]>[$Fix.$D$6];[$Fix.$D$6];IF([.J16]<-[$Fix.$D$6];-[$Fix.$D$6];[.J16])) -> 15 | L16: of:=ROUND(IF([.D16]>[.F16];1-(1/[$Fix.$D$6])*[.K16];IF([.D16]<[.F16];1+(1/[$Fix.$D$6])*[.K16];(1/[$Fix.$D$6])*[.K16]));2) -> 1 | M16: of:=IF(ABS([.D16]-[.F16])>[.O16];[.L16]*1.5;[.L16]) -> 1 | N16: of:=IF([.I16]="x";[.M16]*[.P16];[.M16]) -> 3 | O16: of:=[$Fix.$D$4] -> 5 | P16: of:=[$Fix.$D$5] -> 3 | Q16: of:=IF([.D16]>[.F16];[.C16]+[.N16];[.C16]-[.N16]) -> 83.99 | R16: of:=IF([.E16]="";"";[.Q16]) ->  | T16: of:=IF([.D16]="";[.C16];(IF([.E16]<>"";[.R16];[.S16]))) -> 86.99 | U16: of:=[.T16]-[.C16] -> 0
B17: LD | C17: of:=[1996CR1.T17] -> 70.41 | G17: of:=IF([.D17]<=[.F17];[.E17]+[.N17];[.E17]-[.N17]) -> 3 | I17: x | J17: of:=IF([.H17]="x";[.C17]-[.E17];[.C17]-[.E17]+3) -> 73.41 | K17: of:=IF([.J17]>[$Fix.$D$6];[$Fix.$D$6];IF([.J17]<-[$Fix.$D$6];-[$Fix.$D$6];[.J17])) -> 15 | L17: of:=ROUND(IF([.D17]>[.F17];1-(1/[$Fix.$D$6])*[.K17];IF([.D17]<[.F17];1+(1/[$Fix.$D$6])*[.K17];(1/[$Fix.$D$6])*[.K17]));2) -> 1 | M17: of:=IF(ABS([.D17]-[.F17])>[.O17];[.L17]*1.5;[.L17]) -> 1 | N17: of:=IF([.I17]="x";[.M17]*[.P17];[.M17]) -> 3 | O17: of:=[$Fix.$D$4] -> 5 | P17: of:=[$Fix.$D$5] -> 3 | Q17: of:=IF([.D17]>[.F17];[.C17]+[.N17];[.C17]-[.N17]) -> 67.41 | R17: of:=IF([.E17]="";"";[.Q17]) ->  | T17: of:=IF([.D17]="";[.C17];(IF([.E17]<>"";[.R17];[.S17]))) -> 70.41 | U17: of:=[.T17]-[.C17] -> 0
B18: LH | C18: of:=[1996CR1.T18] -> 86.29 | G18: of:=IF([.D18]<=[.F18];[.E18]+[.N18];[.E18]-[.N18]) -> 3 | I18: x | J18: of:=IF([.H18]="x";[.C18]-[.E18];[.C18]-[.E18]+3) -> 89.29 | K18: of:=IF([.J18]>[$Fix.$D$6];[$Fix.$D$6];IF([.J18]<-[$Fix.$D$6];-[$Fix.$D$6];[.J18])) -> 15 | L18: of:=ROUND(IF([.D18]>[.F18];1-(1/[$Fix.$D$6])*[.K18];IF([.D18]<[.F18];1+(1/[$Fix.$D$6])*[.K18];(1/[$Fix.$D$6])*[.K18]));2) -> 1 | M18: of:=IF(ABS([.D18]-[.F18])>[.O18];[.L18]*1.5;[.L18]) -> 1 | N18: of:=IF([.I18]="x";[.M18]*[.P18];[.M18]) -> 3 | O18: of:=[$Fix.$D$4] -> 5 | P18: of:=[$Fix.$D$5] -> 3 | Q18: of:=IF([.D18]>[.F18];[.C18]+[.N18];[.C18]-[.N18]) -> 83.29 | R18: of:=IF([.E18]="";"";[.Q18]) ->  | T18: of:=IF([.D18]="";[.C18];(IF([.E18]<>"";[.R18];[.S18]))) -> 86.29 | U18: of:=[.T18]-[.C18] -> 0
B19: LK | C19: of:=[1996CR1.T19] -> 69.45 | G19: of:=IF([.D19]<=[.F19];[.E19]+[.N19];[.E19]-[.N19]) -> 3 | I19: x | J19: of:=IF([.H19]="x";[.C19]-[.E19];[.C19]-[.E19]+3) -> 72.45 | K19: of:=IF([.J19]>[$Fix.$D$6];[$Fix.$D$6];IF([.J19]<-[$Fix.$D$6];-[$Fix.$D$6];[.J19])) -> 15 | L19: of:=ROUND(IF([.D19]>[.F19];1-(1/[$Fix.$D$6])*[.K19];IF([.D19]<[.F19];1+(1/[$Fix.$D$6])*[.K19];(1/[$Fix.$D$6])*[.K19]));2) -> 1 | M19: of:=IF(ABS([.D19]-[.F19])>[.O19];[.L19]*1.5;[.L19]) -> 1 | N19: of:=IF([.I19]="x";[.M19]*[.P19];[.M19]) -> 3 | O19: of:=[$Fix.$D$4] -> 5 | P19: of:=[$Fix.$D$5] -> 3 | Q19: of:=IF([.D19]>[.F19];[.C19]+[.N19];[.C19]-[.N19]) -> 66.45 | R19: of:=IF([.E19]="";"";[.Q19]) ->  | T19: of:=IF([.D19]="";[.C19];(IF([.E19]<>"";[.R19];[.S19]))) -> 69.45 | U19: of:=[.T19]-[.C19] -> 0
B20: LM | C20: of:=[1996CR1.T20] -> 82.88 | G20: of:=IF([.D20]<=[.F20];[.E20]+[.N20];[.E20]-[.N20]) -> 3 | I20: x | J20: of:=IF([.H20]="x";[.C20]-[.E20];[.C20]-[.E20]+3) -> 85.88 | K20: of:=IF([.J20]>[$Fix.$D$6];[$Fix.$D$6];IF([.J20]<-[$Fix.$D$6];-[$Fix.$D$6];[.J20])) -> 15 | L20: of:=ROUND(IF([.D20]>[.F20];1-(1/[$Fix.$D$6])*[.K20];IF([.D20]<[.F20];1+(1/[$Fix.$D$6])*[.K20];(1/[$Fix.$D$6])*[.K20]));2) -> 1 | M20: of:=IF(ABS([.D20]-[.F20])>[.O20];[.L20]*1.5;[.L20]) -> 1 | N20: of:=IF([.I20]="x";[.M20]*[.P20];[.M20]) -> 3 | O20: of:=[$Fix.$D$4] -> 5 | P20: of:=[$Fix.$D$5] -> 3 | Q20: of:=IF([.D20]>[.F20];[.C20]+[.N20];[.C20]-[.N20]) -> 79.88 | R20: of:=IF([.E20]="";"";[.Q20]) ->  | T20: of:=IF([.D20]="";[.C20];(IF([.E20]<>"";[.R20];[.S20]))) -> 82.88 | U20: of:=[.T20]-[.C20] -> 0
B21: London | C21: of:=[1996CR1.T21] -> 61.5 | G21: of:=IF([.D21]<=[.F21];[.E21]+[.N21];[.E21]-[.N21]) -> 3 | I21: x | J21: of:=IF([.H21]="x";[.C21]-[.E21];[.C21]-[.E21]+3) -> 64.5 | K21: of:=IF([.J21]>[$Fix.$D$6];[$Fix.$D$6];IF([.J21]<-[$Fix.$D$6];-[$Fix.$D$6];[.J21])) -> 15 | L21: of:=ROUND(IF([.D21]>[.F21];1-(1/[$Fix.$D$6])*[.K21];IF([.D21]<[.F21];1+(1/[$Fix.$D$6])*[.K21];(1/[$Fix.$D$6])*[.K21]));2) -> 1 | M21: of:=IF(ABS([.D21]-[.F21])>[.O21];[.L21]*1.5;[.L21]) -> 1 | N21: of:=IF([.I21]="x";[.M21]*[.P21];[.M21]) -> 3 | O21: of:=[$Fix.$D$4] -> 5 | P21: of:=[$Fix.$D$5] -> 3 | Q21: of:=IF([.D21]>[.F21];[.C21]+[.N21];[.C21]-[.N21]) -> 58.5 | R21: of:=IF([.E21]="";"";[.Q21]) ->  | T21: of:=IF([.D21]="";[.C21];(IF([.E21]<>"";[.R21];[.S21]))) -> 61.5 | U21: of:=[.T21]-[.C21] -> 0
B22: LS | C22: of:=[1996CR1.T22] -> 82.015 | G22: of:=IF([.D22]<=[.F22];[.E22]+[.N22];[.E22]-[.N22]) -> 3 | I22: x | J22: of:=IF([.H22]="x";[.C22]-[.E22];[.C22]-[.E22]+3) -> 85.015 | K22: of:=IF([.J22]>[$Fix.$D$6];[$Fix.$D$6];IF([.J22]<-[$Fix.$D$6];-[$Fix.$D$6];[.J22])) -> 15 | L22: of:=ROUND(IF([.D22]>[.F22];1-(1/[$Fix.$D$6])*[.K22];IF([.D22]<[.F22];1+(1/[$Fix.$D$6])*[.K22];(1/[$Fix.$D$6])*[.K22]));2) -> 1 | M22: of:=IF(ABS([.D22]-[.F22])>[.O22];[.L22]*1.5;[.L22]) -> 1 | N22: of:=IF([.I22]="x";[.M22]*[.P22];[.M22]) -> 3 | O22: of:=[$Fix.$D$4] -> 5 | P22: of:=[$Fix.$D$5] -> 3 | Q22: of:=IF([.D22]>[.F22];[.C22]+[.N22];[.C22]-[.N22]) -> 79.015 | R22: of:=IF([.E22]="";"";[.Q22]) ->  | T22: of:=IF([.D22]="";[.C22];(IF([.E22]<>"";[.R22];[.S22]))) -> 82.015 | U22: of:=[.T22]-[.C22] -> 0
B23: MH | C23: of:=[1996CR1.T23] -> 85.55 | G23: of:=IF([.D23]<=[.F23];[.E23]+[.N23];[.E23]-[.N23]) -> 3 | I23: x | J23: of:=IF([.H23]="x";[.C23]-[.E23];[.C23]-[.E23]+3) -> 88.55 | K23: of:=IF([.J23]>[$Fix.$D$6];[$Fix.$D$6];IF([.J23]<-[$Fix.$D$6];-[$Fix.$D$6];[.J23])) -> 15 | L23: of:=ROUND(IF([.D23]>[.F23];1-(1/[$Fix.$D$6])*[.K23];IF([.D23]<[.F23];1+(1/[$Fix.$D$6])*[.K23];(1/[$Fix.$D$6])*[.K23]));2) -> 1 | M23: of:=IF(ABS([.D23]-[.F23])>[.O23];[.L23]*1.5;[.L23]) -> 1 | N23: of:=IF([.I23]="x";[.M23]*[.P23];[.M23]) -> 3 | O23: of:=[$Fix.$D$4] -> 5 | P23: of:=[$Fix.$D$5] -> 3 | Q23: of:=IF([.D23]>[.F23];[.C23]+[.N23];[.C23]-[.N23]) -> 82.55 | R23: of:=IF([.E23]="";"";[.Q23]) ->  | T23: of:=IF([.D23]="";[.C23];(IF([.E23]<>"";[.R23];[.S23]))) -> 85.55 | U23: of:=[.T23]-[.C23] -> 0
B24: Monaghan | C24: of:=[1996CR1.T24] -> 87.34 | G24: of:=IF([.D24]<=[.F24];[.E24]+[.N24];[.E24]-[.N24]) -> 3 | I24: x | J24: of:=IF([.H24]="x";[.C24]-[.E24];[.C24]-[.E24]+3) -> 90.34 | K24: of:=IF([.J24]>[$Fix.$D$6];[$Fix.$D$6];IF([.J24]<-[$Fix.$D$6];-[$Fix.$D$6];[.J24])) -> 15 | L24: of:=ROUND(IF([.D24]>[.F24];1-(1/[$Fix.$D$6])*[.K24];IF([.D24]<[.F24];1+(1/[$Fix.$D$6])*[.K24];(1/[$Fix.$D$6])*[.K24]));2) -> 1 | M24: of:=IF(ABS([.D24]-[.F24])>[.O24];[.L24]*1.5;[.L24]) -> 1 | N24: of:=IF([.I24]="x";[.M24]*[.P24];[.M24]) -> 3 | O24: of:=[$Fix.$D$4] -> 5 | P24: of:=[$Fix.$D$5] -> 3 | Q24: of:=IF([.D24]>[.F24];[.C24]+[.N24];[.C24]-[.N24]) -> 84.34 | R24: of:=IF([.E24]="";"";[.Q24]) ->  | T24: of:=IF([.D24]="";[.C24];(IF([.E24]<>"";[.R24];[.S24]))) -> 87.34 | U24: of:=[.T24]-[.C24] -> 0
B25: MO | C25: of:=[1996CR1.T25] -> 85.745 | G25: of:=IF([.D25]<=[.F25];[.E25]+[.N25];[.E25]-[.N25]) -> 3 | I25: x | J25: of:=IF([.H25]="x";[.C25]-[.E25];[.C25]-[.E25]+3) -> 88.745 | K25: of:=IF([.J25]>[$Fix.$D$6];[$Fix.$D$6];IF([.J25]<-[$Fix.$D$6];-[$Fix.$D$6];[.J25])) -> 15 | L25: of:=ROUND(IF([.D25]>[.F25];1-(1/[$Fix.$D$6])*[.K25];IF([.D25]<[.F25];1+(1/[$Fix.$D$6])*[.K25];(1/[$Fix.$D$6])*[.K25]));2) -> 1 | M25: of:=IF(ABS([.D25]-[.F25])>[.O25];[.L25]*1.5;[.L25]) -> 1 | N25: of:=IF([.I25]="x";[.M25]*[.P25];[.M25]) -> 3 | O25: of:=[$Fix.$D$4] -> 5 | P25: of:=[$Fix.$D$5] -> 3 | Q25: of:=IF([.D25]>[.F25];[.C25]+[.N25];[.C25]-[.N25]) -> 82.745 | R25: of:=IF([.E25]="";"";[.Q25]) ->  | T25: of:=IF([.D25]="";[.C25];(IF([.E25]<>"";[.R25];[.S25]))) -> 85.745 | U25: of:=[.T25]-[.C25] -> 0
B26: NY | C26: of:=[1996CR1.T26] -> 0 | G26: of:=IF([.D26]<=[.F26];[.E26]+[.N26];[.E26]-[.N26]) -> 0.6 | I26: x | J26: of:=IF([.H26]="x";[.C26]-[.E26];[.C26]-[.E26]+3) -> 3 | K26: of:=IF([.J26]>[$Fix.$D$6];[$Fix.$D$6];IF([.J26]<-[$Fix.$D$6];-[$Fix.$D$6];[.J26])) -> 3 | L26: of:=ROUND(IF([.D26]>[.F26];1-(1/[$Fix.$D$6])*[.K26];IF([.D26]<[.F26];1+(1/[$Fix.$D$6])*[.K26];(1/[$Fix.$D$6])*[.K26]));2) -> 0.2 | M26: of:=IF(ABS([.D26]-[.F26])>[.O26];[.L26]*1.5;[.L26]) -> 0.2 | N26: of:=IF([.I26]="x";[.M26]*[.P26];[.M26]) -> 0.6 | O26: of:=[$Fix.$D$4] -> 5 | P26: of:=[$Fix.$D$5] -> 3 | Q26: of:=IF([.D26]>[.F26];[.C26]+[.N26];[.C26]-[.N26]) -> -0.6 | R26: of:=IF([.E26]="";"";[.Q26]) ->  | T26: of:=IF([.D26]="";[.C26];(IF([.E26]<>"";[.R26];[.S26]))) -> 0 | U26: of:=[.T26]-[.C26] -> 0
B27: OY | C27: of:=[1996CR1.T27] -> 72.945 | G27: of:=IF([.D27]<=[.F27];[.E27]+[.N27];[.E27]-[.N27]) -> 3 | I27: x | J27: of:=IF([.H27]="x";[.C27]-[.E27];[.C27]-[.E27]+3) -> 75.945 | K27: of:=IF([.J27]>[$Fix.$D$6];[$Fix.$D$6];IF([.J27]<-[$Fix.$D$6];-[$Fix.$D$6];[.J27])) -> 15 | L27: of:=ROUND(IF([.D27]>[.F27];1-(1/[$Fix.$D$6])*[.K27];IF([.D27]<[.F27];1+(1/[$Fix.$D$6])*[.K27];(1/[$Fix.$D$6])*[.K27]));2) -> 1 | M27: of:=IF(ABS([.D27]-[.F27])>[.O27];[.L27]*1.5;[.L27]) -> 1 | N27: of:=IF([.I27]="x";[.M27]*[.P27];[.M27]) -> 3 | O27: of:=[$Fix.$D$4] -> 5 | P27: of:=[$Fix.$D$5] -> 3 | Q27: of:=IF([.D27]>[.F27];[.C27]+[.N27];[.C27]-[.N27]) -> 69.945 | R27: of:=IF([.E27]="";"";[.Q27]) ->  | T27: of:=IF([.D27]="";[.C27];(IF([.E27]<>"";[.R27];[.S27]))) -> 72.945 | U27: of:=[.T27]-[.C27] -> 0
B28: RN | C28: of:=[1996CR1.T28] -> 82.09 | G28: of:=IF([.D28]<=[.F28];[.E28]+[.N28];[.E28]-[.N28]) -> 3 | I28: x | J28: of:=IF([.H28]="x";[.C28]-[.E28];[.C28]-[.E28]+3) -> 85.09 | K28: of:=IF([.J28]>[$Fix.$D$6];[$Fix.$D$6];IF([.J28]<-[$Fix.$D$6];-[$Fix.$D$6];[.J28])) -> 15 | L28: of:=ROUND(IF([.D28]>[.F28];1-(1/[$Fix.$D$6])*[.K28];IF([.D28]<[.F28];1+(1/[$Fix.$D$6])*[.K28];(1/[$Fix.$D$6])*[.K28]));2) -> 1 | M28: of:=IF(ABS([.D28]-[.F28])>[.O28];[.L28]*1.5;[.L28]) -> 1 | N28: of:=IF([.I28]="x";[.M28]*[.P28];[.M28]) -> 3 | O28: of:=[$Fix.$D$4] -> 5 | P28: of:=[$Fix.$D$5] -> 3 | Q28: of:=IF([.D28]>[.F28];[.C28]+[.N28];[.C28]-[.N28]) -> 79.09 | R28: of:=IF([.E28]="";"";[.Q28]) ->  | T28: of:=IF([.D28]="";[.C28];(IF([.E28]<>"";[.R28];[.S28]))) -> 82.09 | U28: of:=[.T28]-[.C28] -> 0
B29: SO | C29: of:=[1996CR1.T29] -> 69.99 | G29: of:=IF([.D29]<=[.F29];[.E29]+[.N29];[.E29]-[.N29]) -> 3 | I29: x | J29: of:=IF([.H29]="x";[.C29]-[.E29];[.C29]-[.E29]+3) -> 72.99 | K29: of:=IF([.J29]>[$Fix.$D$6];[$Fix.$D$6];IF([.J29]<-[$Fix.$D$6];-[$Fix.$D$6];[.J29])) -> 15 | L29: of:=ROUND(IF([.D29]>[.F29];1-(1/[$Fix.$D$6])*[.K29];IF([.D29]<[.F29];1+(1/[$Fix.$D$6])*[.K29];(1/[$Fix.$D$6])*[.K29]));2) -> 1 | M29: of:=IF(ABS([.D29]-[.F29])>[.O29];[.L29]*1.5;[.L29]) -> 1 | N29: of:=IF([.I29]="x";[.M29]*[.P29];[.M29]) -> 3 | O29: of:=[$Fix.$D$4] -> 5 | P29: of:=[$Fix.$D$5] -> 3 | Q29: of:=IF([.D29]>[.F29];[.C29]+[.N29];[.C29]-[.N29]) -> 66.99 | R29: of:=IF([.E29]="";"";[.Q29]) ->  | T29: of:=IF([.D29]="";[.C29];(IF([.E29]<>"";[.R29];[.S29]))) -> 69.99 | U29: of:=[.T29]-[.C29] -> 0
B30: TP | C30: of:=[1996CR1.T30] -> 74.875 | G30: of:=IF([.D30]<=[.F30];[.E30]+[.N30];[.E30]-[.N30]) -> 3 | I30: x | J30: of:=IF([.H30]="x";[.C30]-[.E30];[.C30]-[.E30]+3) -> 77.875 | K30: of:=IF([.J30]>[$Fix.$D$6];[$Fix.$D$6];IF([.J30]<-[$Fix.$D$6];-[$Fix.$D$6];[.J30])) -> 15 | L30: of:=ROUND(IF([.D30]>[.F30];1-(1/[$Fix.$D$6])*[.K30];IF([.D30]<[.F30];1+(1/[$Fix.$D$6])*[.K30];(1/[$Fix.$D$6])*[.K30]));2) -> 1 | M30: of:=IF(ABS([.D30]-[.F30])>[.O30];[.L30]*1.5;[.L30]) -> 1 | N30: of:=IF([.I30]="x";[.M30]*[.P30];[.M30]) -> 3 | O30: of:=[$Fix.$D$4] -> 5 | P30: of:=[$Fix.$D$5] -> 3 | Q30: of:=IF([.D30]>[.F30];[.C30]+[.N30];[.C30]-[.N30]) -> 71.875 | R30: of:=IF([.E30]="";"";[.Q30]) ->  | T30: of:=IF([.D30]="";[.C30];(IF([.E30]<>"";[.R30];[.S30]))) -> 74.875 | U30: of:=[.T30]-[.C30] -> 0
B31: TY | C31: of:=[1996CR1.T31] -> 91.985 | G31: of:=IF([.D31]<=[.F31];[.E31]+[.N31];[.E31]-[.N31]) -> 3 | I31: x | J31: of:=IF([.H31]="x";[.C31]-[.E31];[.C31]-[.E31]+3) -> 94.985 | K31: of:=IF([.J31]>[$Fix.$D$6];[$Fix.$D$6];IF([.J31]<-[$Fix.$D$6];-[$Fix.$D$6];[.J31])) -> 15 | L31: of:=ROUND(IF([.D31]>[.F31];1-(1/[$Fix.$D$6])*[.K31];IF([.D31]<[.F31];1+(1/[$Fix.$D$6])*[.K31];(1/[$Fix.$D$6])*[.K31]));2) -> 1 | M31: of:=IF(ABS([.D31]-[.F31])>[.O31];[.L31]*1.5;[.L31]) -> 1 | N31: of:=IF([.I31]="x";[.M31]*[.P31];[.M31]) -> 3 | O31: of:=[$Fix.$D$4] -> 5 | P31: of:=[$Fix.$D$5] -> 3 | Q31: of:=IF([.D31]>[.F31];[.C31]+[.N31];[.C31]-[.N31]) -> 88.985 | R31: of:=IF([.E31]="";"";[.Q31]) ->  | T31: of:=IF([.D31]="";[.C31];(IF([.E31]<>"";[.R31];[.S31]))) -> 91.985 | U31: of:=[.T31]-[.C31] -> 0
B32: WD | C32: of:=[1996CR1.T32] -> 65.815 | G32: of:=IF([.D32]<=[.F32];[.E32]+[.N32];[.E32]-[.N32]) -> 3 | I32: x | J32: of:=IF([.H32]="x";[.C32]-[.E32];[.C32]-[.E32]+3) -> 68.815 | K32: of:=IF([.J32]>[$Fix.$D$6];[$Fix.$D$6];IF([.J32]<-[$Fix.$D$6];-[$Fix.$D$6];[.J32])) -> 15 | L32: of:=ROUND(IF([.D32]>[.F32];1-(1/[$Fix.$D$6])*[.K32];IF([.D32]<[.F32];1+(1/[$Fix.$D$6])*[.K32];(1/[$Fix.$D$6])*[.K32]));2) -> 1 | M32: of:=IF(ABS([.D32]-[.F32])>[.O32];[.L32]*1.5;[.L32]) -> 1 | N32: of:=IF([.I32]="x";[.M32]*[.P32];[.M32]) -> 3 | O32: of:=[$Fix.$D$4] -> 5 | P32: of:=[$Fix.$D$5] -> 3 | Q32: of:=IF([.D32]>[.F32];[.C32]+[.N32];[.C32]-[.N32]) -> 62.815 | R32: of:=IF([.E32]="";"";[.Q32]) ->  | T32: of:=IF([.D32]="";[.C32];(IF([.E32]<>"";[.R32];[.S32]))) -> 65.815 | U32: of:=[.T32]-[.C32] -> 0
B33: WH | C33: of:=[1996CR1.T33] -> 71.025 | G33: of:=IF([.D33]<=[.F33];[.E33]+[.N33];[.E33]-[.N33]) -> 3 | I33: x | J33: of:=IF([.H33]="x";[.C33]-[.E33];[.C33]-[.E33]+3) -> 74.025 | K33: of:=IF([.J33]>[$Fix.$D$6];[$Fix.$D$6];IF([.J33]<-[$Fix.$D$6];-[$Fix.$D$6];[.J33])) -> 15 | L33: of:=ROUND(IF([.D33]>[.F33];1-(1/[$Fix.$D$6])*[.K33];IF([.D33]<[.F33];1+(1/[$Fix.$D$6])*[.K33];(1/[$Fix.$D$6])*[.K33]));2) -> 1 | M33: of:=IF(ABS([.D33]-[.F33])>[.O33];[.L33]*1.5;[.L33]) -> 1 | N33: of:=IF([.I33]="x";[.M33]*[.P33];[.M33]) -> 3 | O33: of:=[$Fix.$D$4] -> 5 | P33: of:=[$Fix.$D$5] -> 3 | Q33: of:=IF([.D33]>[.F33];[.C33]+[.N33];[.C33]-[.N33]) -> 68.025 | R33: of:=IF([.E33]="";"";[.Q33]) ->  | T33: of:=IF([.D33]="";[.C33];(IF([.E33]<>"";[.R33];[.S33]))) -> 71.025 | U33: of:=[.T33]-[.C33] -> 0
B34: WW | C34: of:=[1996CR1.T34] -> 78.645 | D34: 16 | G34: of:=IF([.D34]<=[.F34];[.E34]+[.N34];[.E34]-[.N34]) -> 0 | I34: x | J34: of:=IF([.H34]="x";[.C34]-[.E34];[.C34]-[.E34]+3) -> 81.645 | K34: of:=IF([.J34]>[$Fix.$D$6];[$Fix.$D$6];IF([.J34]<-[$Fix.$D$6];-[$Fix.$D$6];[.J34])) -> 15 | L34: of:=ROUND(IF([.D34]>[.F34];1-(1/[$Fix.$D$6])*[.K34];IF([.D34]<[.F34];1+(1/[$Fix.$D$6])*[.K34];(1/[$Fix.$D$6])*[.K34]));2) -> 0 | M34: of:=IF(ABS([.D34]-[.F34])>[.O34];[.L34]*1.5;[.L34]) -> 0 | N34: of:=IF([.I34]="x";[.M34]*[.P34];[.M34]) -> 0 | O34: of:=[$Fix.$D$4] -> 5 | P34: of:=[$Fix.$D$5] -> 3 | Q34: of:=IF([.D34]>[.F34];[.C34]+[.N34];[.C34]-[.N34]) -> 78.645 | R34: of:=IF([.E34]="";"";[.Q34]) ->  | S34: of:=[.G7] -> 75.375 | T34: of:=IF([.D34]="";[.C34];(IF([.E34]<>"";[.R34];[.S34]))) -> 75.375 | U34: of:=[.T34]-[.C34] -> -3.27
B35: WX | C35: of:=[1996CR1.T35] -> 73.275 | G35: of:=IF([.D35]<=[.F35];[.E35]+[.N35];[.E35]-[.N35]) -> 3 | I35: x | J35: of:=IF([.H35]="x";[.C35]-[.E35];[.C35]-[.E35]+3) -> 76.275 | K35: of:=IF([.J35]>[$Fix.$D$6];[$Fix.$D$6];IF([.J35]<-[$Fix.$D$6];-[$Fix.$D$6];[.J35])) -> 15 | L35: of:=ROUND(IF([.D35]>[.F35];1-(1/[$Fix.$D$6])*[.K35];IF([.D35]<[.F35];1+(1/[$Fix.$D$6])*[.K35];(1/[$Fix.$D$6])*[.K35]));2) -> 1 | M35: of:=IF(ABS([.D35]-[.F35])>[.O35];[.L35]*1.5;[.L35]) -> 1 | N35: of:=IF([.I35]="x";[.M35]*[.P35];[.M35]) -> 3 | O35: of:=[$Fix.$D$4] -> 5 | P35: of:=[$Fix.$D$5] -> 3 | Q35: of:=IF([.D35]>[.F35];[.C35]+[.N35];[.C35]-[.N35]) -> 70.275 | R35: of:=IF([.E35]="";"";[.Q35]) ->  | T35: of:=IF([.D35]="";[.C35];(IF([.E35]<>"";[.R35];[.S35]))) -> 73.275 | U35: of:=[.T35]-[.C35] -> 0
T36: of:=SUM([.T2:.T35]) -> 2640 | U36: of:=SUM([.U2:.U35]) -> 0